{
  "schemaVersion": 1,
  "consumer": {
    "projectionId": "openrouter-research-credit-v3",
    "projectionSpecDigest": "sha256:8ceb069ac04b284681f1a690fdcd923ea9c744aa30209a3364c23445a07241ba",
    "problemId": "no-three-in-line-77",
    "canonicalHead": "3a8f622a3a76a4026f456f1351a05a4b3da0d6ca"
  },
  "problemLedger": {
    "problemLedgerHead": "17928a941d7503ff0dc32740b707f475728300a3",
    "problemLedgerDigest": "sha256:621d2dfa7452294f9698c71e4f086eca0f0d77f6c1314b7c08450465092d519a"
  },
  "dependencies": [
    {
      "name": "research",
      "projectionId": "openrouter-research-v3",
      "projectionSpecDigest": "sha256:7dccde09901cc89e121eab5302922715c1b57d31c721958a19fc4455eaeaa5db",
      "artifactRole": "research-program-state",
      "runKind": "knowledge-build",
      "runDigest": "sha256:cba0e290245079415b8e86997009d7a14e5c41f18413183fb8e56ac058a26f38",
      "ledgerHead": "3a8f622a3a76a4026f456f1351a05a4b3da0d6ca",
      "problemLedgerHead": "17928a941d7503ff0dc32740b707f475728300a3",
      "problemLedgerDigest": "sha256:621d2dfa7452294f9698c71e4f086eca0f0d77f6c1314b7c08450465092d519a",
      "artifact": {
        "bytes": 34322,
        "digest": "sha256:3e588bc5add20eaa5ff9f7f824e9d38a75731ad7ec3bb8a7ac1576aab360d56f",
        "mediaType": "application/json",
        "path": "state/state.json",
        "role": "research-program-state"
      }
    }
  ],
  "dependencyLockDigest": "sha256:69fd2724adffc3961fa4b42f80d7d027fa9a5459c316612d9643acf4ea2bf26e"
}
