{
  "schemaVersion": 1,
  "consumer": {
    "projectionId": "openrouter-research-credit-v3",
    "projectionSpecDigest": "sha256:8ceb069ac04b284681f1a690fdcd923ea9c744aa30209a3364c23445a07241ba",
    "problemId": "bssc-sum-capacity",
    "canonicalHead": "9ff49a7c2d1c242d6cb29cf9afd34803b06d2383"
  },
  "problemLedger": {
    "problemLedgerHead": "9ff49a7c2d1c242d6cb29cf9afd34803b06d2383",
    "problemLedgerDigest": "sha256:37b8aa776cd00dcccca6dadedac46ef0a596b69d2ac8f576a1e7b9f8272b77c5"
  },
  "dependencies": [
    {
      "name": "research",
      "projectionId": "openrouter-research-v3",
      "projectionSpecDigest": "sha256:7dccde09901cc89e121eab5302922715c1b57d31c721958a19fc4455eaeaa5db",
      "artifactRole": "research-program-state",
      "runKind": "knowledge-build",
      "runDigest": "sha256:6149417354857151da0e2ae910d608b457ec06ffe9d898f9db858e206198def5",
      "ledgerHead": "9ff49a7c2d1c242d6cb29cf9afd34803b06d2383",
      "problemLedgerHead": "9ff49a7c2d1c242d6cb29cf9afd34803b06d2383",
      "problemLedgerDigest": "sha256:37b8aa776cd00dcccca6dadedac46ef0a596b69d2ac8f576a1e7b9f8272b77c5",
      "artifact": {
        "bytes": 115447,
        "digest": "sha256:aa5a1a94e4bffb7b55ef8b8f8335380f8da492a4b5e42991cc8f9ecdb551383d",
        "mediaType": "application/json",
        "path": "state/state.json",
        "role": "research-program-state"
      }
    }
  ],
  "dependencyLockDigest": "sha256:5500e55aded0523f5235ba8cae408e480d76ac7021e86cba3ea10930eb43c882"
}
