{
  "schemaVersion": 1,
  "consumer": {
    "projectionId": "openrouter-research-credit-v3",
    "projectionSpecDigest": "sha256:8ceb069ac04b284681f1a690fdcd923ea9c744aa30209a3364c23445a07241ba",
    "problemId": "bssc-sum-capacity",
    "canonicalHead": "5ed3f525b9ae7f32c6e1dcbf22ecdb5ae946a4a6"
  },
  "problemLedger": {
    "problemLedgerHead": "5ed3f525b9ae7f32c6e1dcbf22ecdb5ae946a4a6",
    "problemLedgerDigest": "sha256:d13ce4b47df28ee706bc52c4c199e36f974743f8f9b223244ad18ec4004c1c4c"
  },
  "dependencies": [
    {
      "name": "research",
      "projectionId": "openrouter-research-v3",
      "projectionSpecDigest": "sha256:7dccde09901cc89e121eab5302922715c1b57d31c721958a19fc4455eaeaa5db",
      "artifactRole": "research-program-state",
      "runKind": "knowledge-build",
      "runDigest": "sha256:2b12e1b571bba2e700c538ce51d7e9025b1b3cbbcb62ae5e772671ad39e3aca8",
      "ledgerHead": "5ed3f525b9ae7f32c6e1dcbf22ecdb5ae946a4a6",
      "problemLedgerHead": "5ed3f525b9ae7f32c6e1dcbf22ecdb5ae946a4a6",
      "problemLedgerDigest": "sha256:d13ce4b47df28ee706bc52c4c199e36f974743f8f9b223244ad18ec4004c1c4c",
      "artifact": {
        "bytes": 67344,
        "digest": "sha256:24761f69faa14f75106df62c8dd31d526fd480d023c0f3608ef0ebc4d6641845",
        "mediaType": "application/json",
        "path": "state/state.json",
        "role": "research-program-state"
      }
    }
  ],
  "dependencyLockDigest": "sha256:26ca9651e041b61bda07783e2b0da9ea3edf556a0c7e1b7c920e3ca6b75bd6b1"
}
